{
  "schema_version": "1.0.0",
  "id": "cutlass.sm90a.atom.wgmma-fp32-fp8_e5m2-fp8_e5m2-64x136x32-ss-tn",
  "level": "atom",
  "name": "SM90a WGMMA 64x136x32 fp8_e5m2/fp8_e5m2 to fp32 SS",
  "summary": "Issue a Hopper warpgroup 64x136x32 WGMMA with fp8_e5m2/fp8_e5m2 operands in SS mode and fp32 accumulators.",
  "primitives": [
    "wgmma.mma_async",
    "MMA_64x136x32_F32E5M2E5M2_SS_TN"
  ],
  "strategy": {
    "intent": "Map GEMM arithmetic to architecture-native Tensor Core instructions.",
    "mechanism": "Use the CUTLASS GMMA wrapper collectively across a warpgroup; operand residency mode is SS.",
    "expected_benefit": "Uses the GPU matrix-multiply datapath instead of scalar arithmetic.",
    "tradeoffs": [
      "Requires compatible fragment layouts, data types, alignment, and architecture support."
    ]
  },
  "parameters": [
    {
      "name": "operand_mode",
      "kind": "choice",
      "description": "A/B register or shared-memory residency encoded by the wrapper.",
      "values": [
        "SS"
      ]
    },
    {
      "name": "scale_d",
      "kind": "choice",
      "description": "Accumulator participation/scaling control.",
      "values": [
        0,
        1
      ]
    }
  ],
  "constraints": [
    {
      "type": "architecture",
      "expression": "arch == sm90a",
      "rationale": "WGMMA wrappers require SM90a architecture features."
    },
    {
      "type": "dtype",
      "expression": "A == fp8_e5m2 && B == fp8_e5m2 && accumulator == fp32",
      "rationale": "Types are encoded in the wrapper name."
    },
    {
      "type": "shape",
      "expression": "mma_shape == (64, 136, 32)",
      "rationale": "The WGMMA instruction shape is fixed."
    },
    {
      "type": "dependency",
      "expression": "operand_mode == SS",
      "rationale": "SS and RS wrappers require different operand descriptors/fragments."
    },
    {
      "type": "semantic",
      "expression": "sparse == false",
      "rationale": "Sparse WGMMA variants require metadata and structured sparsity semantics."
    }
  ],
  "architectures": [
    "sm90a"
  ],
  "source": {
    "library": "CUTLASS",
    "version": "4.7.0",
    "license": "BSD-3-Clause",
    "references": [
      {
        "path": "cutlass-main/include/cute/arch/mma_sm90_gmma_ext.hpp",
        "line_start": 51832,
        "line_end": 51832,
        "symbol": "MMA_64x136x32_F32E5M2E5M2_SS_TN",
        "evidence": "CUTLASS declares this named GMMA wrapper at the referenced source line."
      }
    ]
  },
  "tags": [
    "hopper",
    "wgmma",
    "tensor-core",
    "ss",
    "fp8_e5m2",
    "fp32"
  ],
  "status": "candidate",
  "notes": [
    "Automatically extracted; requires semantic review before promotion to curated."
  ]
}
