{
  "schema_version": "1.0.0",
  "id": "cutlass.sm90a.collective.tma-wgmma-ss",
  "level": "collective",
  "name": "SM90 TMA/WGMMA shared-shared mainloop",
  "summary": "Use TMA producer warps to fill staged shared-memory A/B tiles and WGMMA consumer warpgroups to compute in SS mode.",
  "primitives": [
    "CollectiveMma<"
  ],
  "strategy": {
    "intent": "Coordinate GEMM data movement, Tensor Core computation, synchronization, and result processing across threads or warps.",
    "mechanism": "Use TMA producer warps to fill staged shared-memory A/B tiles and WGMMA consumer warpgroups to compute in SS mode.",
    "expected_benefit": "Overlaps work and eliminates unnecessary global-memory traffic or kernel launches.",
    "tradeoffs": [
      "Collective strategies consume shared memory, registers, synchronization resources, and specialized warp roles."
    ]
  },
  "parameters": [
    {
      "name": "stages",
      "kind": "integer",
      "description": "Collective configuration parameter: stages."
    },
    {
      "name": "cluster_shape",
      "kind": "choice",
      "description": "Collective configuration parameter: cluster_shape."
    },
    {
      "name": "kernel_schedule",
      "kind": "choice",
      "description": "Collective configuration parameter: kernel_schedule."
    }
  ],
  "constraints": [
    {
      "type": "dependency",
      "expression": "SS WGMMA and TMA Atom methods match tile layouts",
      "rationale": "Required for correctness or resource feasibility of this collective strategy."
    },
    {
      "type": "resource",
      "expression": "pipeline_storage_fits_smem",
      "rationale": "Required for correctness or resource feasibility of this collective strategy."
    }
  ],
  "architectures": [
    "sm90",
    "sm90a"
  ],
  "source": {
    "library": "CUTLASS",
    "version": "4.7.0",
    "license": "BSD-3-Clause",
    "references": [
      {
        "path": "cutlass-main/include/cutlass/gemm/collective/sm90_mma_tma_gmma_ss_warpspecialized.hpp",
        "line_start": 72,
        "line_end": 72,
        "symbol": "CollectiveMma<",
        "evidence": "The referenced CUTLASS collective implements the described cooperation strategy."
      }
    ]
  },
  "tags": [
    "hopper",
    "tma",
    "wgmma",
    "ss",
    "warp-specialized"
  ],
  "status": "candidate",
  "notes": [
    "Rule-extracted method; requires semantic review before promotion to curated."
  ]
}
