{
  "schema_version": "1.0.0",
  "id": "cutlass.sm90a.atom.sparse-wgmma-int32-int8-int8-64x32x64-rs-tn-saturate",
  "level": "atom",
  "name": "SM90a sparse WGMMA 64x32x64 int8/int8 to int32 RS",
  "summary": "Issue a Hopper warpgroup 64x32x64 sparse WGMMA with int8/int8 operands in RS mode and int32 accumulators.",
  "primitives": [
    "wgmma.mma_async",
    "GMMA_64x32x64_S32S8S8_RS_TN_SATURATE"
  ],
  "strategy": {
    "intent": "Map GEMM arithmetic to architecture-native Tensor Core instructions.",
    "mechanism": "Use the CUTLASS GMMA wrapper collectively across a warpgroup; operand residency mode is RS.",
    "expected_benefit": "Uses the GPU matrix-multiply datapath instead of scalar arithmetic.",
    "tradeoffs": [
      "Requires compatible fragment layouts, data types, alignment, and architecture support."
    ]
  },
  "parameters": [
    {
      "name": "operand_mode",
      "kind": "choice",
      "description": "A/B register or shared-memory residency encoded by the wrapper.",
      "values": [
        "RS"
      ]
    },
    {
      "name": "scale_d",
      "kind": "choice",
      "description": "Accumulator participation/scaling control.",
      "values": [
        0,
        1
      ]
    }
  ],
  "constraints": [
    {
      "type": "architecture",
      "expression": "arch == sm90a",
      "rationale": "WGMMA wrappers require SM90a architecture features."
    },
    {
      "type": "dtype",
      "expression": "A == int8 && B == int8 && accumulator == int32",
      "rationale": "Types are encoded in the wrapper name."
    },
    {
      "type": "shape",
      "expression": "mma_shape == (64, 32, 64)",
      "rationale": "The WGMMA instruction shape is fixed."
    },
    {
      "type": "dependency",
      "expression": "operand_mode == RS",
      "rationale": "SS and RS wrappers require different operand descriptors/fragments."
    },
    {
      "type": "semantic",
      "expression": "sparse == true",
      "rationale": "Sparse WGMMA variants require metadata and structured sparsity semantics."
    }
  ],
  "architectures": [
    "sm90a"
  ],
  "source": {
    "library": "CUTLASS",
    "version": "4.7.0",
    "license": "BSD-3-Clause",
    "references": [
      {
        "path": "cutlass-main/include/cute/arch/mma_sm90_gmma_sparse.hpp",
        "line_start": 6179,
        "line_end": 6179,
        "symbol": "GMMA_64x32x64_S32S8S8_RS_TN_SATURATE",
        "evidence": "CUTLASS declares this named GMMA wrapper at the referenced source line."
      }
    ]
  },
  "tags": [
    "hopper",
    "wgmma",
    "tensor-core",
    "rs",
    "int8",
    "int32",
    "sparse"
  ],
  "status": "candidate",
  "notes": [
    "Automatically extracted; requires semantic review before promotion to curated."
  ]
}
