{
  "schema_version": "1.0.0",
  "id": "cutlass.collective.silu-fusion",
  "level": "collective",
  "name": "Fused SiLU output operation",
  "summary": "Apply SiLU after the GEMM linear combination without a separate activation kernel.",
  "primitives": [
    "using LinearCombinationSilu"
  ],
  "strategy": {
    "intent": "Coordinate GEMM data movement, Tensor Core computation, synchronization, and result processing across threads or warps.",
    "mechanism": "Apply SiLU after the GEMM linear combination without a separate activation kernel.",
    "expected_benefit": "Overlaps work and eliminates unnecessary global-memory traffic or kernel launches.",
    "tradeoffs": [
      "Collective strategies consume shared memory, registers, synchronization resources, and specialized warp roles."
    ]
  },
  "parameters": [
    {
      "name": "alpha",
      "kind": "choice",
      "description": "Collective configuration parameter: alpha."
    },
    {
      "name": "beta",
      "kind": "choice",
      "description": "Collective configuration parameter: beta."
    },
    {
      "name": "compute_dtype",
      "kind": "choice",
      "description": "Collective configuration parameter: compute_dtype."
    }
  ],
  "constraints": [
    {
      "type": "dtype",
      "expression": "compute type supports sigmoid evaluation",
      "rationale": "Required for correctness or resource feasibility of this collective strategy."
    }
  ],
  "architectures": [
    "sm80",
    "sm90",
    "sm90a"
  ],
  "source": {
    "library": "CUTLASS",
    "version": "4.7.0",
    "license": "BSD-3-Clause",
    "references": [
      {
        "path": "cutlass-main/include/cutlass/epilogue/thread/linear_combination_silu.h",
        "line_start": 63,
        "line_end": 63,
        "symbol": "using LinearCombinationSilu",
        "evidence": "The referenced CUTLASS collective implements the described cooperation strategy."
      }
    ]
  },
  "tags": [
    "epilogue",
    "silu",
    "activation",
    "fusion"
  ],
  "status": "candidate",
  "notes": [
    "Rule-extracted method; requires semantic review before promotion to curated."
  ]
}
