{
  "schema_version": "1.0.0",
  "id": "cutlass.device.sm-count-discovery",
  "level": "device",
  "name": "Runtime SM-count discovery",
  "summary": "Query the device multiprocessor count for persistent-grid and occupancy-aware launch sizing.",
  "primitives": [
    "cudaDevAttrMultiProcessorCount"
  ],
  "strategy": {
    "intent": "Turn a composed GEMM kernel into a safe, reusable host-callable operation.",
    "mechanism": "Query the device multiprocessor count for persistent-grid and occupancy-aware launch sizing.",
    "expected_benefit": "Provides uniform validation, resource management, launch, and workload-mode integration.",
    "tradeoffs": [
      "Device wrappers add host-side policy and workspace requirements that must remain consistent with the selected kernel."
    ]
  },
  "parameters": [
    {
      "name": "device_ordinal",
      "kind": "choice",
      "description": "Device integration parameter: device_ordinal."
    },
    {
      "name": "device_sms",
      "kind": "choice",
      "description": "Device integration parameter: device_sms."
    }
  ],
  "constraints": [
    {
      "type": "semantic",
      "expression": "queried ordinal matches the launch device",
      "rationale": "Required for a valid and correctly ordered device execution."
    }
  ],
  "architectures": [
    "sm80",
    "sm90",
    "sm90a"
  ],
  "source": {
    "library": "CUTLASS",
    "version": "4.7.0",
    "license": "BSD-3-Clause",
    "references": [
      {
        "path": "cutlass-main/include/cutlass/gemm/device/gemm_universal_base.h",
        "line_start": 150,
        "line_end": 150,
        "symbol": "cudaDevAttrMultiProcessorCount",
        "evidence": "The referenced CUTLASS device API implements this integration method."
      }
    ]
  },
  "tags": [
    "device-api",
    "hardware-query",
    "occupancy"
  ],
  "status": "candidate",
  "notes": [
    "Rule-extracted method; requires semantic review before promotion to curated."
  ]
}
