{
  "schema_version": "1.0.0",
  "id": "cutlass.sm90a.atom.sparse-wgmma-fp32-fp16-fp16-64x96x32-ss",
  "level": "atom",
  "name": "SM90a sparse WGMMA 64x96x32 fp16/fp16 to fp32 SS",
  "summary": "Issue a Hopper warpgroup 64x96x32 sparse WGMMA with fp16/fp16 operands in SS mode and fp32 accumulators.",
  "primitives": [
    "wgmma.mma_async",
    "GMMA_64x96x32_F32F16F16_SS"
  ],
  "strategy": {
    "intent": "Map GEMM arithmetic to architecture-native Tensor Core instructions.",
    "mechanism": "Use the CUTLASS GMMA wrapper collectively across a warpgroup; operand residency mode is SS.",
    "expected_benefit": "Uses the GPU matrix-multiply datapath instead of scalar arithmetic.",
    "tradeoffs": [
      "Requires compatible fragment layouts, data types, alignment, and architecture support."
    ]
  },
  "parameters": [
    {
      "name": "operand_mode",
      "kind": "choice",
      "description": "A/B register or shared-memory residency encoded by the wrapper.",
      "values": [
        "SS"
      ]
    },
    {
      "name": "scale_d",
      "kind": "choice",
      "description": "Accumulator participation/scaling control.",
      "values": [
        0,
        1
      ]
    }
  ],
  "constraints": [
    {
      "type": "architecture",
      "expression": "arch == sm90a",
      "rationale": "WGMMA wrappers require SM90a architecture features."
    },
    {
      "type": "dtype",
      "expression": "A == fp16 && B == fp16 && accumulator == fp32",
      "rationale": "Types are encoded in the wrapper name."
    },
    {
      "type": "shape",
      "expression": "mma_shape == (64, 96, 32)",
      "rationale": "The WGMMA instruction shape is fixed."
    },
    {
      "type": "dependency",
      "expression": "operand_mode == SS",
      "rationale": "SS and RS wrappers require different operand descriptors/fragments."
    },
    {
      "type": "semantic",
      "expression": "sparse == true",
      "rationale": "Sparse WGMMA variants require metadata and structured sparsity semantics."
    }
  ],
  "architectures": [
    "sm90a"
  ],
  "source": {
    "library": "CUTLASS",
    "version": "4.7.0",
    "license": "BSD-3-Clause",
    "references": [
      {
        "path": "cutlass-main/include/cute/arch/mma_sm90_gmma_sparse.hpp",
        "line_start": 1523,
        "line_end": 1523,
        "symbol": "GMMA_64x96x32_F32F16F16_SS",
        "evidence": "CUTLASS declares this named GMMA wrapper at the referenced source line."
      }
    ]
  },
  "tags": [
    "hopper",
    "wgmma",
    "tensor-core",
    "ss",
    "fp16",
    "fp32",
    "sparse"
  ],
  "status": "candidate",
  "notes": [
    "Automatically extracted; requires semantic review before promotion to curated."
  ]
}
